[
  {
    "id": "ne10m-river-0",
    "scenarioId": "1326",
    "source": "natural-earth 10m rivers @ca96624a56bd078437bca8184e78163e5039ad19",
    "confidence": "HIGH",
    "points": [
      [
        36.7234,
        38.6385
      ],
      [
        36.8667,
        38.6508
      ],
      [
        36.9024,
        38.6116
      ],
      [
        36.9024,
        38.5699
      ],
      [
        36.8816,
        38.5633
      ],
      [
        36.886,
        38.5223
      ],
      [
        36.84,
        38.4739
      ],
      [
        36.9132,
        38.4479
      ],
      [
        36.9581,
        38.3382
      ],
      [
        36.9999,
        38.3206
      ],
      [
        37.0164,
        38.2928
      ],
      [
        37.104,
        38.2683
      ],
      [
        37.1138,
        38.248
      ],
      [
        37.0918,
        38.2085
      ],
      [
        37.0195,
        38.174
      ],
      [
        36.9822,
        38.1039
      ],
      [
        36.9937,
        38.0674
      ],
      [
        37.0963,
        38.0612
      ],
      [
        37.0961,
        38.0247
      ],
      [
        36.9815,
        37.9715
      ],
      [
        36.9659,
        37.9303
      ],
      [
        36.9669,
        37.8266
      ],
      [
        36.9431,
        37.8091
      ],
      [
        36.9116,
        37.7395
      ],
      [
        36.8502,
        37.7078
      ],
      [
        36.7789,
        37.5833
      ],
      [
        36.7581,
        37.5696
      ],
      [
        36.7643,
        37.59
      ],
      [
        36.6824,
        37.5969
      ],
      [
        36.6526,
        37.5301
      ],
      [
        36.477,
        37.4536
      ],
      [
        36.46,
        37.4224
      ],
      [
        36.4701,
        37.3771
      ],
      [
        36.3707,
        37.3563
      ],
      [
        36.3541,
        37.3709
      ],
      [
        36.2857,
        37.3477
      ],
      [
        36.2504,
        37.2952
      ],
      [
        36.2677,
        37.2603
      ],
      [
        36.2187,
        37.1625
      ],
      [
        36.1611,
        37.1587
      ],
      [
        36.0927,
        37.1785
      ],
      [
        36.0559,
        37.2105
      ],
      [
        35.9907,
        37.2206
      ],
      [
        35.9417,
        37.2125
      ],
      [
        35.8878,
        37.1785
      ],
      [
        35.8469,
        37.1854
      ],
      [
        35.8125,
        37.1368
      ],
      [
        35.8189,
        37.1177
      ],
      [
        35.7986,
        37.1177
      ],
      [
        35.84,
        37.083
      ],
      [
        35.7854,
        37.052
      ],
      [
        35.8054,
        37.0215
      ],
      [
        35.7643,
        37.0327
      ],
      [
        35.7575,
        37.0141
      ],
      [
        35.6089,
        36.9522
      ],
      [
        35.5857,
        36.9185
      ],
      [
        35.6197,
        36.9042
      ],
      [
        35.5652,
        36.9042
      ],
      [
        35.5857,
        36.8632
      ],
      [
        35.5748,
        36.8485
      ],
      [
        35.5037,
        36.8496
      ],
      [
        35.4758,
        36.8223
      ],
      [
        35.4885,
        36.8066
      ],
      [
        35.4758,
        36.7608
      ],
      [
        35.4895,
        36.7405
      ],
      [
        35.4758,
        36.6578
      ],
      [
        35.5447,
        36.6683
      ],
      [
        35.572,
        36.6509
      ],
      [
        35.5932,
        36.6168
      ],
      [
        35.5675,
        36.587
      ]
    ]
  },
  {
    "id": "ne10m-river-1",
    "scenarioId": "1326",
    "source": "natural-earth 10m rivers @ca96624a56bd078437bca8184e78163e5039ad19",
    "confidence": "HIGH",
    "points": [
      [
        29.12,
        39.0995
      ],
      [
        29.0418,
        39.0976
      ],
      [
        28.8892,
        39.1713
      ],
      [
        28.6098,
        39.1873
      ],
      [
        28.3449,
        39.269
      ],
      [
        28.2185,
        39.2694
      ],
      [
        28.1699,
        39.2869
      ],
      [
        28.1305,
        39.2752
      ],
      [
        28.0698,
        39.3489
      ],
      [
        28.0699,
        39.3779
      ],
      [
        28.1235,
        39.4456
      ],
      [
        28.1255,
        39.4703
      ],
      [
        28.11,
        39.557
      ],
      [
        28.069,
        39.6179
      ],
      [
        28.0696,
        39.6595
      ],
      [
        28.2056,
        39.7227
      ],
      [
        28.2398,
        39.7625
      ],
      [
        28.1681,
        39.8
      ],
      [
        28.1803,
        39.8538
      ],
      [
        28.1518,
        39.858
      ],
      [
        28.1653,
        39.8717
      ],
      [
        28.1572,
        39.9269
      ],
      [
        28.1744,
        39.9381
      ],
      [
        28.1741,
        40.0034
      ],
      [
        28.1988,
        40.0362
      ],
      [
        28.1856,
        40.0519
      ],
      [
        28.1988,
        40.0709
      ],
      [
        28.2223,
        40.0726
      ],
      [
        28.4141,
        40.2755
      ],
      [
        28.4589,
        40.2969
      ],
      [
        28.499,
        40.3907
      ]
    ]
  },
  {
    "id": "ne10m-river-2",
    "scenarioId": "1326",
    "source": "natural-earth 10m rivers @ca96624a56bd078437bca8184e78163e5039ad19",
    "confidence": "HIGH",
    "points": [
      [
        39.6183,
        39.8789
      ],
      [
        39.6265,
        39.9063
      ],
      [
        39.7158,
        39.9785
      ],
      [
        39.6343,
        40.005
      ],
      [
        39.5903,
        40.0856
      ],
      [
        39.4419,
        40.1387
      ],
      [
        39.2378,
        40.0946
      ],
      [
        39.1012,
        40.1319
      ],
      [
        39.0816,
        40.1075
      ],
      [
        39.0385,
        40.0958
      ],
      [
        38.9352,
        40.1218
      ],
      [
        38.5341,
        40.1436
      ],
      [
        38.4581,
        40.1666
      ],
      [
        38.3794,
        40.1477
      ],
      [
        38.3203,
        40.1727
      ],
      [
        38.3178,
        40.2054
      ],
      [
        38.2476,
        40.2399
      ],
      [
        38.1397,
        40.2484
      ],
      [
        38.047,
        40.2235
      ],
      [
        37.8907,
        40.2821
      ],
      [
        37.0073,
        40.4942
      ],
      [
        36.9431,
        40.5325
      ],
      [
        36.9225,
        40.6072
      ],
      [
        36.8816,
        40.6252
      ],
      [
        36.8059,
        40.6252
      ],
      [
        36.8059,
        40.6469
      ],
      [
        36.7681,
        40.6606
      ],
      [
        36.7166,
        40.6531
      ],
      [
        36.6812,
        40.6785
      ],
      [
        36.5523,
        40.7158
      ],
      [
        36.5099,
        40.7708
      ],
      [
        36.4412,
        40.7991
      ],
      [
        36.4098,
        40.8315
      ],
      [
        36.4148,
        40.8586
      ],
      [
        36.4431,
        40.8704
      ],
      [
        36.5937,
        40.9101
      ],
      [
        36.6555,
        40.9095
      ],
      [
        36.6541,
        40.9453
      ],
      [
        36.6314,
        40.9548
      ],
      [
        36.6435,
        41.027
      ],
      [
        36.6681,
        41.0367
      ],
      [
        36.6809,
        41.0869
      ],
      [
        36.7302,
        41.1193
      ],
      [
        36.7437,
        41.1528
      ],
      [
        36.7234,
        41.1841
      ],
      [
        36.7166,
        41.2496
      ],
      [
        36.6824,
        41.2565
      ],
      [
        36.6824,
        41.331
      ],
      [
        36.6494,
        41.3399
      ],
      [
        36.6607,
        41.3665
      ]
    ]
  },
  {
    "id": "ne10m-river-3",
    "scenarioId": "1326",
    "source": "natural-earth 10m rivers @ca96624a56bd078437bca8184e78163e5039ad19",
    "confidence": "HIGH",
    "points": [
      [
        39.1731,
        38.4244
      ],
      [
        39.2127,
        38.4244
      ],
      [
        39.2882,
        38.4671
      ],
      [
        39.4026,
        38.5034
      ],
      [
        39.509,
        38.5169
      ],
      [
        39.5388,
        38.4864
      ],
      [
        39.6209,
        38.463
      ],
      [
        39.6467,
        38.4318
      ],
      [
        39.6455,
        38.4071
      ],
      [
        39.6894,
        38.377
      ],
      [
        39.7297,
        38.3698
      ],
      [
        39.8149,
        38.387
      ],
      [
        39.9845,
        38.3768
      ],
      [
        40.0304,
        38.3333
      ],
      [
        40.0264,
        38.2916
      ],
      [
        40.1178,
        38.2566
      ],
      [
        40.1912,
        38.2002
      ],
      [
        40.1397,
        38.114
      ],
      [
        40.2053,
        38.1098
      ],
      [
        40.2669,
        38.0835
      ],
      [
        40.2389,
        37.991
      ],
      [
        40.2594,
        37.8985
      ],
      [
        40.232,
        37.8743
      ],
      [
        40.2568,
        37.8389
      ],
      [
        40.4151,
        37.8084
      ],
      [
        40.5185,
        37.8355
      ],
      [
        40.6772,
        37.8438
      ],
      [
        40.7592,
        37.8067
      ],
      [
        40.8433,
        37.8308
      ],
      [
        41.0348,
        37.7717
      ],
      [
        41.0885,
        37.7814
      ],
      [
        41.1172,
        37.7661
      ],
      [
        41.1754,
        37.7672
      ],
      [
        41.2175,
        37.7429
      ],
      [
        41.5473,